{
  "schema_version": "1.1.0",
  "artifact_type": "verification_report",
  "report_id": "vr-example",
  "contract_id": "ctr-example",
  "run_id": "run-example",
  "generated_at": "2026-01-01T00:00:00Z",
  "verifier": {
    "verifier_id": "verifier-1",
    "kind": "hybrid",
    "independent_of_executor": true,
    "independence_assertion": "cli"
  },
  "overall_status": "pass_with_warnings",
  "summary": "Replace with a concise outcome.",
  "checks": [
    {
      "check_id": "example-check",
      "category": "design",
      "method": "review",
      "severity": "error",
      "status": "pass",
      "targets": [],
      "message": "Replace with the recorded result.",
      "supporting_refs": []
    }
  ],
  "extensions": {}
}
